Year,Term,YearTerm,Subject,Number,Name,Description,Credit Hours,Section Info,Degree Attributes,Schedule Information,CRN,Section,Status Code,Part of Term,Section Title,Section Credit Hours,Section Status,Enrollment Status,Type,Type Code,Start Time,End Time,Days of Week,Room,Building,Instructors
2019,Summer,2019-su,AAS,290,Individual Study,Supervised reading and research in Asian American Studies chosen by the student with instructor approval. May be repeated to a maximum of 6 hours. Prerequisite: AAS 100.,2 TO 3 hours.,May be repeated to a maximum of 6 hours. Prerequisite: AAS 100.,,,10027,,A,1,,,A,UNKNOWN,Independent Study,IND,ARRANGED,,,,,
2019,Summer,2019-su,AAS,310,Race and Cultural Diversity,"Same as AFRO 310, EPS 310, and LLS 310. See EPS 310.",4 hours.,"Same as AFRO 310, EPS 310, and LLS 310. See EPS 310.","Advanced Composition, and Cultural Studies - US Minority course.",,37440,A,A,S2,,,A,UNKNOWN,Online,ONL,05:00 PM,07:00 PM,M,,,"Moton, T;Turner, F"
2019,Summer,2019-su,ABE,199,Undergraduate Open Seminar,May be repeated to a maximum of 12 hours.,1 TO 5 hours.,May be repeated to a maximum of 12 hours.,,,10141,,A,1,,,A,UNKNOWN,Independent Study,IND,ARRANGED,,,,,
2019,Summer,2019-su,ABE,397,Independent Study,"Individual research, special problems, thesis, development or design work under the supervision of a member of the faculty. May be repeated to a maximum of 8 hours. Prerequisite: Consent of instructor.",1 TO 4 hours.,May be repeated to a maximum of 8 hours. Prerequisite: Consent of instructor.,,,39506,,A,1,,,A,UNKNOWN,Independent Study,IND,ARRANGED,,,,,
2019,Summer,2019-su,ABE,397,Independent Study,"Individual research, special problems, thesis, development or design work under the supervision of a member of the faculty. May be repeated to a maximum of 8 hours. Prerequisite: Consent of instructor.",1 TO 4 hours.,May be repeated to a maximum of 8 hours. Prerequisite: Consent of instructor.,,,39495,KB,A,1,,,A,UNKNOWN,Independent Study,IND,ARRANGED,,,,,"Bhalerao, K"
2019,Summer,2019-su,ABE,497,Independent Study,"Individual research, special problems, thesis, development or design work under the supervision of a member of the faculty. 1 to 4 undergraduate hours. No graduate credit. May be repeated to a maximum of 8 hours. Prerequisite: Consent of instructor.",1 TO 4 hours.,1 to 4 undergraduate hours. No graduate credit. May be repeated to a maximum of 8 hours. Prerequisite: Consent of instructor.,,,33767,,A,1,,,A,UNKNOWN,Independent Study,IND,ARRANGED,,,,,
2019,Summer,2019-su,ABE,498,Special Topics,Subject offerings of new and developing areas of knowledge in agricultural and biological engineering intended to augment the existing curriculum. See Class Schedule or departmental course information for topics and prerequisites. 1 to 4 undergraduate hours. 1 to 4 graduate hours. May be repeated in the same or separate terms if topics vary to a maximum of 16 hours.,1 to 4 hours.,1 to 4 undergraduate hours. 1 to 4 graduate hours. May be repeated in the same or separate terms if topics vary to a maximum of 16 hours.,,,10169,,A,1,,,A,UNKNOWN,Independent Study,IND,ARRANGED,,,,,
2019,Summer,2019-su,ABE,597,Independent Study,Individual investigations or studies of any phases of agricultural engineering selected by the student and approved by the advisor and the faculty member who will supervise the study. May be repeated to a maximum of 16 hours. Prerequisite: Consent of instructor.,1 TO 4 hours.,May be repeated to a maximum of 16 hours. Prerequisite: Consent of instructor.,,,10174,,A,1,,,A,UNKNOWN,Independent Study,IND,ARRANGED,,,,,
2019,Summer,2019-su,ABE,599,Thesis Research,Approved for S/U grading only. May be repeated.,0 TO 16 hours.,Approved for S/U grading only. May be repeated.,,,10177,,A,1,,,A,UNKNOWN,Independent Study,IND,ARRANGED,,,,,
2019,Summer,2019-su,ACCY,199,Undergraduate Open Seminar,May be repeated.,1 TO 5 hours.,May be repeated.,,,10033,,A,1,,,A,UNKNOWN,Independent Study,IND,ARRANGED,,,,,
2019,Summer,2019-su,ACCY,200,Fundamentals of Accounting,Survey course in the principles of accounting for students registered in schools and colleges other than the College of Business. Credit is not given for both ACCY 200 and either ACCY 201 or ACCY 202. Prerequisite: Sophomore standing.,3 hours.,Credit is not given for both ACCY 200 and either ACCY 201 or ACCY 202. Prerequisite: Sophomore standing.,,,37453,ONL,A,S2,,,A,UNKNOWN,Online,ONL,ARRANGED,,,,,"Silhan, P"
2019,Summer,2019-su,ACCY,290,Prof Internship in Accountancy,"Formalized learning experience in combination with practice of accounting while engaged in an internship with a public accounting firm, business, or other off-campus organization; prior approval of learning plan and a summary report of learning experience are required. Approved for Letter and S/U grading. May be repeated in subsequent terms to a maximum of 3 hours. Prerequisite: Open to Department of Accountancy students; completion of ACCY 201 and ACCY 202 (or equivalent); and consent of department.",0 TO 3 hours.,Approved for Letter and S/U grading. May be repeated in subsequent terms to a maximum of 3 hours. Prerequisite: Open to Department of Accountancy students; completion of ACCY 201 and ACCY 202 (or equivalent); and consent of department.,,,33779,O,A,S2,,,A,UNKNOWN,Conference,CNF,ARRANGED,,,,,"Shapland, J"
2019,Summer,2019-su,ACCY,301,Atg Measurement &amp; Disclosure,"Introduction to measurement and reporting of organizational performance for strategic and operational purposes with a focus on a variety of financial and non-financial performance measures suitable for both internal and external decision-making. Projects, together with a series of practical workshops, facilitate self-discovery of knowledge and development of a variety of professional skills and attitudes. Prerequisite: ACCY 202 or equivalent and recommend concurrent enrollment in ACCY 302 for Accountancy majors.",3 hours.,Prerequisite: ACCY 202 or equivalent and recommend concurrent enrollment in ACCY 302 for Accountancy majors.,,,30026,AE2,A,S2,,,A,UNKNOWN,Lecture-Discussion,LCD,12:30 PM,01:50 PM,MTWR,3001,Business Instructional Fac,"Jang, H"
2019,Summer,2019-su,ACCY,302,Decision Making for Atg,"Decision making implications of information provided to organization managers and to external stakeholders such as investors, creditors, customers, and regulators. Concepts from economics, statistics, and psychology emphasize the use of quantitative techniques to comprehend uncertainty and risk. Projects, together with a series of practical workshops, facilitate self-discovery of knowledge and development of a variety of professional skills and attitudes. Prerequisite: ACCY 202 or equivalent; BADM 210 or concurrent enrollment; and recommend concurrent enrollment in ACCY 301 for Accountancy majors.",3 hours.,Prerequisite: ACCY 202 or equivalent; BADM 210 or concurrent enrollment; and recommend concurrent enrollment in ACCY 301 for Accountancy majors.,,,30037,AE2,A,S2,,,A,UNKNOWN,Lecture-Discussion,LCD,02:00 PM,03:20 PM,MTWR,3001,Business Instructional Fac,"Han, J"
2019,Summer,2019-su,ACCY,303,Atg Institutions and Reg,"Regulation theory and practice as applied to accounting information. A general framework for regulation of accounting procedures is developed. This framework is applied to reporting, taxation, and regulated business activities. Projects facilitate self-discovery of knowledge and the development of professional attitudes and skills with emphasis on professional research. Prerequisite: ACCY 301 and ECON 302 and FIN 221; or consent of department.",3 hours.,Prerequisite: ACCY 301 and ECON 302 and FIN 221; or consent of department.,,,30041,AE1,A,S2,,,A,UNKNOWN,Lecture-Discussion,LCD,11:00 AM,12:20 PM,MTWR,3001,Business Instructional Fac,"Kim, S"
2019,Summer,2019-su,ACCY,304,Accounting Control Systems,"Broad perspective on accounting and control that considers attainment of all goals of an organization, including those concerned with financial objectives. Topics include the conceptual foundations of control and application of practical, analytical tools to the evaluation of an organization's control environment. Cases, class discussion and field research projects emphasize independent thinking, group processes, and communication. Prerequisite: ACCY 301 and ACCY 302 and BADM 310; or consent of department.",3 hours.,Prerequisite: ACCY 301 and ACCY 302 and BADM 310; or consent of department.,,,30061,AE1,A,S2,,,A,UNKNOWN,Lecture-Discussion,LCD,09:30 AM,10:50 AM,MTWR,3003,Business Instructional Fac,"Yip, M"
2019,Summer,2019-su,ACCY,410,Advanced Financial Reporting,"Current authoritative accounting standards and applications to accounting practice. Topics do not represent the full range of financial reporting issues, but are selected based on relevance of the underlying business transaction, complexity of the topic, consistency of applicable standard with underlying reporting concepts, and transferability of the standard to other accounting issues.  3 undergraduate hours. 3 or 4 graduate hours. Prerequisite: ACCY 303 or consent of department.",3 OR 4 hours.,3 undergraduate hours. 3 or 4 graduate hours. Prerequisite: ACCY 303 or consent of department.,,,38235,A3,A,S2,,3 hours,A,UNKNOWN,Lecture-Discussion,LCD,01:00 PM,02:20 PM,MTWR,2007,Business Instructional Fac,"Penn, M"
2019,Summer,2019-su,ACCY,410,Advanced Financial Reporting,"Current authoritative accounting standards and applications to accounting practice. Topics do not represent the full range of financial reporting issues, but are selected based on relevance of the underlying business transaction, complexity of the topic, consistency of applicable standard with underlying reporting concepts, and transferability of the standard to other accounting issues.  3 undergraduate hours. 3 or 4 graduate hours. Prerequisite: ACCY 303 or consent of department.",3 OR 4 hours.,3 undergraduate hours. 3 or 4 graduate hours. Prerequisite: ACCY 303 or consent of department.,,,38336,A4,A,S2,,4 hours,A,UNKNOWN,Lecture-Discussion,LCD,01:00 PM,02:20 PM,MTWR,2007,Business Instructional Fac,"Penn, M"
2019,Summer,2019-su,ACCY,499,Senior Research,"Research and readings course for students majoring in accountancy. May be taken by students in the college honors program in partial fulfillment of the honors requirements. 2 to 4 undergraduate hours. No graduate credit. May be repeated to a maximum of 6 hours. Prerequisite: Cumulative grade-point average of 3.0., honors in the junior year, or consent of department; senior standing.",2 TO 4 hours.,"2 to 4 undergraduate hours. No graduate credit. May be repeated to a maximum of 6 hours. Prerequisite: Cumulative grade-point average of 3.0., honors in the junior year, or consent of department; senior standing.",,,10038,,A,1,,,A,UNKNOWN,Independent Study,IND,ARRANGED,,,,,
2019,Summer,2019-su,ACCY,500,"Accounting Measurement, Reporting, and Control","A managerial perspective of the nature and role of accounting in organizational measurement, reporting and control processes. 2 or 4 graduate hours. No professional credit. Prerequisite: Enrollment in a non-accountancy masters program in business or consent of department.",2 OR 4 hours.,2 or 4 graduate hours. No professional credit. Prerequisite: Enrollment in a non-accountancy masters program in business or consent of department.,,,40211,PMB,A,,,4 hours,A,UNKNOWN,Lecture-Discussion,LCD,06:00 PM,08:50 PM,MW,3007,Business Instructional Fac,"Augusto Sampaio Franco de Lima, G"
2019,Summer,2019-su,ACCY,501,Accounting Analysis I,"Uses of accounting information; collection, processing, and communication of accounting information; measurement of assets, liabilities, equities, and income; and accounting system design. 2 or 4 graduate hours. No professional credit. May be repeated up to 4 hours for iMSA and online students that complete the first part of the course content in a 2-hour section (part A) and then complete the remainder of the class in a second 2-hour section (part B). Prerequisite: Enrollment in graduate degree program or consent of department.",2 OR 4 hours.,2 or 4 graduate hours. No professional credit. May be repeated up to 4 hours for iMSA and online students that complete the first part of the course content in a 2-hour section (part A) and then complete the remainder of the class in a second 2-hour section (part B). Prerequisite: Enrollment in graduate degree program or consent of department.,,,30083,A,A,S2,,4 hours,A,UNKNOWN,Lecture-Discussion,LCD,08:00 AM,09:20 AM,MTWR,3009,Business Instructional Fac,"Augusto Sampaio Franco de Lima, G"
2019,Summer,2019-su,ACCY,501,Accounting Analysis I,"Uses of accounting information; collection, processing, and communication of accounting information; measurement of assets, liabilities, equities, and income; and accounting system design. 2 or 4 graduate hours. No professional credit. May be repeated up to 4 hours for iMSA and online students that complete the first part of the course content in a 2-hour section (part A) and then complete the remainder of the class in a second 2-hour section (part B). Prerequisite: Enrollment in graduate degree program or consent of department.",2 OR 4 hours.,2 or 4 graduate hours. No professional credit. May be repeated up to 4 hours for iMSA and online students that complete the first part of the course content in a 2-hour section (part A) and then complete the remainder of the class in a second 2-hour section (part B). Prerequisite: Enrollment in graduate degree program or consent of department.,,,30086,B,A,S2,,4 hours,A,UNKNOWN,Lecture-Discussion,LCD,09:30 AM,10:50 AM,MTWR,3009,Business Instructional Fac,"Augusto Sampaio Franco de Lima, G"
2019,Summer,2019-su,ACCY,501,Accounting Analysis I,"Uses of accounting information; collection, processing, and communication of accounting information; measurement of assets, liabilities, equities, and income; and accounting system design. 2 or 4 graduate hours. No professional credit. May be repeated up to 4 hours for iMSA and online students that complete the first part of the course content in a 2-hour section (part A) and then complete the remainder of the class in a second 2-hour section (part B). Prerequisite: Enrollment in graduate degree program or consent of department.",2 OR 4 hours.,2 or 4 graduate hours. No professional credit. May be repeated up to 4 hours for iMSA and online students that complete the first part of the course content in a 2-hour section (part A) and then complete the remainder of the class in a second 2-hour section (part B). Prerequisite: Enrollment in graduate degree program or consent of department.,,,32912,C,A,S2,,4 hours,A,UNKNOWN,Lecture-Discussion,LCD,01:00 PM,02:20 PM,MTWR,2011,Business Instructional Fac,"Ibrahim, A"
2019,Summer,2019-su,ACCY,503,Managerial Accounting,"Introduction to management accounting as part of the firm's information system, in terms of modern cost accounting and budgetary systems for planning and controlling business operations. 2 or 4 graduate hours. No professional credit. May be repeated up to 4 hours for iMSA and online students that complete the first part of the course content in a 2-hour section (part A) and then complete the remainder of the class in a second 2-hour section (part B). Prerequisite: Credit or concurrent registration in ACCY 501 or equivalent; enrollment in graduate degree program or consent of department.",2 OR 4 hours.,2 or 4 graduate hours. No professional credit. May be repeated up to 4 hours for iMSA and online students that complete the first part of the course content in a 2-hour section (part A) and then complete the remainder of the class in a second 2-hour section (part B). Prerequisite: Credit or concurrent registration in ACCY 501 or equivalent; enrollment in graduate degree program or consent of department.,,,36386,PMB,A,,,4 hours,A,UNKNOWN,Lecture-Discussion,LCD,06:00 PM,08:50 PM,MW,3039,Business Instructional Fac,"Fisher, M"
2019,Summer,2019-su,ACCY,516,Professional Responsibility and Ethics for Accountants,"This course covers key principles of accountants' professional responsibility in their jobs, organizations, and careers, and adopts both theoretical and practical perspectives of the role of ethics and morals within the accounting discipline. The course begins with a general overview of these key constructs and principles, including various philosophies from a variety of disciplines and cultures. Next, the course provides a historical perspective of major instances of accounting-related ""failures"" and ""successes"" in the area of professional responsibility and ethics. This historical perspective provides the underlying reasoning for many contemporary codes of conduct, ethics, and professional guidelines. A variety of experiential learning opportunities will help students explore and develop their own perspective on ethics and morals, and how these principles affect their professional roles, responsibilities, and choices. 3 graduate hours. No professional credit.",3 hours.,3 graduate hours. No professional credit.,,,40284,DA1,A,S2,,,A,UNKNOWN,Online,ONL,ARRANGED,,,,,"Curtis, S"
2019,Summer,2019-su,ACCY,516,Professional Responsibility and Ethics for Accountants,"This course covers key principles of accountants' professional responsibility in their jobs, organizations, and careers, and adopts both theoretical and practical perspectives of the role of ethics and morals within the accounting discipline. The course begins with a general overview of these key constructs and principles, including various philosophies from a variety of disciplines and cultures. Next, the course provides a historical perspective of major instances of accounting-related ""failures"" and ""successes"" in the area of professional responsibility and ethics. This historical perspective provides the underlying reasoning for many contemporary codes of conduct, ethics, and professional guidelines. A variety of experiential learning opportunities will help students explore and develop their own perspective on ethics and morals, and how these principles affect their professional roles, responsibilities, and choices. 3 graduate hours. No professional credit.",3 hours.,3 graduate hours. No professional credit.,,,40285,NA1,A,S2,,,A,UNKNOWN,Online,ONL,ARRANGED,,,,,"Curtis, S"
2019,Summer,2019-su,ACCY,593,Special Research Problems,"Individual investigations or research projects selected by the students, subject to approval by the graduate adviser and the executive officer of the Department. May be repeated in the same or separate terms. Prerequisite: Enrollment in graduate accounting degree program or consent of department.",1 TO 8 hours.,May be repeated in the same or separate terms. Prerequisite: Enrollment in graduate accounting degree program or consent of department.,,,10041,,A,1,,,A,UNKNOWN,Independent Study,IND,ARRANGED,,,,,
2019,Summer,2019-su,ACCY,593,Special Research Problems,"Individual investigations or research projects selected by the students, subject to approval by the graduate adviser and the executive officer of the Department. May be repeated in the same or separate terms. Prerequisite: Enrollment in graduate accounting degree program or consent of department.",1 TO 8 hours.,May be repeated in the same or separate terms. Prerequisite: Enrollment in graduate accounting degree program or consent of department.,,,30098,AT1,A,S2,,4 hours,A,UNKNOWN,Lecture-Discussion,S2,12:30 PM,01:50 PM,MTWR,3009,Business Instructional Fac,"Kustanovich, M"
2019,Summer,2019-su,ACCY,593,Special Research Problems,"Individual investigations or research projects selected by the students, subject to approval by the graduate adviser and the executive officer of the Department. May be repeated in the same or separate terms. Prerequisite: Enrollment in graduate accounting degree program or consent of department.",1 TO 8 hours.,May be repeated in the same or separate terms. Prerequisite: Enrollment in graduate accounting degree program or consent of department.,,,30096,AT2,A,S2,,4 hours,A,UNKNOWN,Lecture-Discussion,S1,11:00 AM,12:20 PM,MTWR,3009,Business Instructional Fac,"Kustanovich, M"
2019,Summer,2019-su,ACCY,593,Special Research Problems,"Individual investigations or research projects selected by the students, subject to approval by the graduate adviser and the executive officer of the Department. May be repeated in the same or separate terms. Prerequisite: Enrollment in graduate accounting degree program or consent of department.",1 TO 8 hours.,May be repeated in the same or separate terms. Prerequisite: Enrollment in graduate accounting degree program or consent of department.,,,40240,DA1,A,,Infonomics,4 hours,A,UNKNOWN,Online,ONL,ARRANGED,,,,,"Laney, D"
2019,Summer,2019-su,ACCY,593,Special Research Problems,"Individual investigations or research projects selected by the students, subject to approval by the graduate adviser and the executive officer of the Department. May be repeated in the same or separate terms. Prerequisite: Enrollment in graduate accounting degree program or consent of department.",1 TO 8 hours.,May be repeated in the same or separate terms. Prerequisite: Enrollment in graduate accounting degree program or consent of department.,,,30101,MS1,A,S2,Prof Soft Skills I,2 hours,A,UNKNOWN,Lecture-Discussion,LCD,02:30 PM,03:50 PM,MW,2041,Business Instructional Fac,"Reierson, T"
2019,Summer,2019-su,ACCY,593,Special Research Problems,"Individual investigations or research projects selected by the students, subject to approval by the graduate adviser and the executive officer of the Department. May be repeated in the same or separate terms. Prerequisite: Enrollment in graduate accounting degree program or consent of department.",1 TO 8 hours.,May be repeated in the same or separate terms. Prerequisite: Enrollment in graduate accounting degree program or consent of department.,,,32293,MS2,A,S2,Prof Soft Skills I,2 hours,A,UNKNOWN,Lecture-Discussion,LCD,04:00 PM,05:20 PM,MW,2041,Business Instructional Fac,"Reierson, T"
2019,Summer,2019-su,ACCY,593,Special Research Problems,"Individual investigations or research projects selected by the students, subject to approval by the graduate adviser and the executive officer of the Department. May be repeated in the same or separate terms. Prerequisite: Enrollment in graduate accounting degree program or consent of department.",1 TO 8 hours.,May be repeated in the same or separate terms. Prerequisite: Enrollment in graduate accounting degree program or consent of department.,,,40462,MS3,A,S2,Prof Soft Skills I,2 hours,A,UNKNOWN,Lecture-Discussion,LCD,07:00 PM,08:20 PM,MW,2043,Business Instructional Fac,"Reierson, T"
2019,Summer,2019-su,ACCY,593,Special Research Problems,"Individual investigations or research projects selected by the students, subject to approval by the graduate adviser and the executive officer of the Department. May be repeated in the same or separate terms. Prerequisite: Enrollment in graduate accounting degree program or consent of department.",1 TO 8 hours.,May be repeated in the same or separate terms. Prerequisite: Enrollment in graduate accounting degree program or consent of department.,,,40241,NA1,A,,Infonomics,4 hours,A,UNKNOWN,Online,ONL,ARRANGED,,,,,"Laney, D"
2019,Summer,2019-su,ACCY,593,Special Research Problems,"Individual investigations or research projects selected by the students, subject to approval by the graduate adviser and the executive officer of the Department. May be repeated in the same or separate terms. Prerequisite: Enrollment in graduate accounting degree program or consent of department.",1 TO 8 hours.,May be repeated in the same or separate terms. Prerequisite: Enrollment in graduate accounting degree program or consent of department.,,,30104,SP1,A,S2,,4 hours,A,UNKNOWN,Conference,CNF,ARRANGED,,,,,
2019,Summer,2019-su,ACCY,593,Special Research Problems,"Individual investigations or research projects selected by the students, subject to approval by the graduate adviser and the executive officer of the Department. May be repeated in the same or separate terms. Prerequisite: Enrollment in graduate accounting degree program or consent of department.",1 TO 8 hours.,May be repeated in the same or separate terms. Prerequisite: Enrollment in graduate accounting degree program or consent of department.,,,40203,SP2,A,S2,,4 hours,A,UNKNOWN,Conference,CNF,ARRANGED,,,,,"Chen, X"
2019,Summer,2019-su,ACCY,599,Thesis Research,Individual direction and guidance in writing theses; seminar discussion of progress made. Approved for S/U grading only. May be repeated.,0 TO 16 hours.,Approved for S/U grading only. May be repeated.,,,29870,A,A,SF,,,A,UNKNOWN,Conference,CNF,ARRANGED,,,,,"Chen, X"
2019,Summer,2019-su,ACE,100,Agr Cons and Resource Econ,"Principles of microeconomics; demand, production, supply, elasticity, markets, and trade are presented and used in the analysis of decisions of individuals relating to agricultural production, food and textile consumption, and natural resource use. Macroeconomic concepts are also introduced. Credit is not given for ACE 100 if credit for ECON 102 has been earned.",4 hours.,Credit is not given for ACE 100 if credit for ECON 102 has been earned.,Social & Beh Sci - Soc Sci course.,Students must register for one discussion and one lecture section.,37030,ONL,A,S2,,,A,UNKNOWN,Online,ONL,ARRANGED,,,,,"Gundersen, L"
2019,Summer,2019-su,ACE,161,Microcomputer Applications,Instruction and practice in solving data-related problems with microcomputers and general purpose software packages.,3 hours.,,,Weekly participation is required in a laboratory discussion and in 1-2 hours (unscheduled) on microcomputer projects.,37025,ONL,A,S2,,,A,UNKNOWN,Online,ONL,ARRANGED,,,,,"Burnett, M"
