Year,Term,YearTerm,Subject,Number,Name,Description,Credit Hours,Section Info,Degree Attributes,Schedule Information,CRN,Section,Status Code,Part of Term,Section Title,Section Credit Hours,Section Status,Enrollment Status,Type,Type Code,Start Time,End Time,Days of Week,Room,Building,Instructors
2019,Summer,2019-su,HIST,273,Illinois History,"History of Chicago and Illinois from prehistoric times to the present, illustrating the jarring conflicts and great achievements of peoples from all over the world. Politics, economics, popular and high culture, education, mass media, racial problems, and ethnic diversity are especially featured. There is an emphasis on the relation of city, state, and region to one another.",3 hours.,,Humanities - Hist & Phil course.,,36308,B,A,S2,,,A,UNKNOWN,Online,ONL,ARRANGED,,,,,"Rezende Da Silva De Sant'ana, T"
2019,Summer,2019-su,HIST,398,Internship in Public History,"With a faculty sponsor, a qualified students will develop a program of study or research related to an internship or other relevant employment opportunity. Consult departmental undergraduate advisor or Director of Undergraduate Studies. Approved for letter and S/U grading. May be repeated in separate terms to a maximum of 6 hours. Prerequisite: Consent of faculty sponsor and Director of Undergraduate Studies required.",1 TO 3 hours.,Approved for letter and S/U grading. May be repeated in separate terms to a maximum of 6 hours. Prerequisite: Consent of faculty sponsor and Director of Undergraduate Studies required.,,,36697,,A,1,,,A,UNKNOWN,Independent Study,IND,ARRANGED,,,,,
2019,Summer,2019-su,HIST,399,Independent Study,Readings in selected fields in consultation with the instructor resulting in a 20-30 page paper. May be repeated with permission of the Director of Undergraduate Studies. Prerequisite: Junior or senior standing pursuing a History major; written consent of instructor and History undergraduate advisor required.,1 TO 3 hours.,May be repeated with permission of the Director of Undergraduate Studies. Prerequisite: Junior or senior standing pursuing a History major; written consent of instructor and History undergraduate advisor required.,,,34192,,A,1,,,A,UNKNOWN,Independent Study,IND,ARRANGED,,,,,
2019,Summer,2019-su,HIST,490,Honors Independent Study,"Independent reading, research, and writing under the supervision of an individual instructor. Seniors in the History Honors Program taking this course in place of the Honors Senior Thesis must complete a substantive research paper (25-30 pages). No graduate credit. May be repeated to a maximum of 6 hours. Each 3-hour class must be taken with a different instructor. Prerequisite: Admission to the History Honors Program; or junior or senior of high standing with the consent of the Director of Undergraduate Studies.",3 hours.,No graduate credit. May be repeated to a maximum of 6 hours. Each 3-hour class must be taken with a different instructor. Prerequisite: Admission to the History Honors Program; or junior or senior of high standing with the consent of the Director of Undergraduate Studies.,,,10419,,A,1,,,A,UNKNOWN,Independent Study,IND,ARRANGED,,,,,
2019,Summer,2019-su,HIST,493,Honors Senior Thesis,"Two-term independent research and writing project under the supervision of a faculty advisor. Students enrolled in this course must submit a completed Honors Senior Thesis at the end of the second term, for evaluation by the faculty advisor and a second reader. 3 undergraduate hours. No graduate credit. Must be repeated for a total of 6 hours. Students will receive separate grades for each semester's work. Prerequisite: Admission to the History Honors Program and consent of supervising professor; HIST 492 and HIST 495; concurrent enrollment in HIST 499 is required.",3 hours.,3 undergraduate hours. No graduate credit. Must be repeated for a total of 6 hours. Students will receive separate grades for each semester's work. Prerequisite: Admission to the History Honors Program and consent of supervising professor; HIST 492 and HIST 495; concurrent enrollment in HIST 499 is required.,,,10420,,A,1,,,A,UNKNOWN,Independent Study,IND,ARRANGED,,,,,
2019,Summer,2019-su,HIST,596,Individual Research Project,Directed research in special fields; may be taken in lieu of seminars in fields in which seminars are seldom offered. Topics will be listed in the department's course guide at http://www.history.illinois.edu. May be repeated to a maximum of 12 hours if topics vary.,4 hours.,May be repeated to a maximum of 12 hours if topics vary.,,,10421,,A,1,,,A,UNKNOWN,Independent Study,IND,ARRANGED,,,,,
2019,Summer,2019-su,HIST,597,Reading Course,"Directed readings in special fields. Primarily, but not exclusively, for students with a master's degree or equivalent, who are preparing for the preliminary examination in history and who need instruction in areas not provided by current course offerings. Approved for letter and S/U grading.  May be repeated in the same or subsequent terms as topics vary. Prerequisite: Consent of instructor.",0 TO 4 hours.,Approved for letter and S/U grading.  May be repeated in the same or subsequent terms as topics vary. Prerequisite: Consent of instructor.,,,10422,,A,1,,,A,UNKNOWN,Independent Study,IND,ARRANGED,,,,,
2019,Summer,2019-su,HIST,597,Reading Course,"Directed readings in special fields. Primarily, but not exclusively, for students with a master's degree or equivalent, who are preparing for the preliminary examination in history and who need instruction in areas not provided by current course offerings. Approved for letter and S/U grading.  May be repeated in the same or subsequent terms as topics vary. Prerequisite: Consent of instructor.",0 TO 4 hours.,Approved for letter and S/U grading.  May be repeated in the same or subsequent terms as topics vary. Prerequisite: Consent of instructor.,,,30812,P,A,S2,Prelim Reading,,A,UNKNOWN,Discussion/Recitation,DIS,ARRANGED,,,,,"Steinberg, M"
2019,Summer,2019-su,HIST,598,Teaching of College History,Approved for S/U grading only. May be repeated.  Prerequisite: Candidate for Ph.D. degree in history.,2 hours.,Approved for S/U grading only. May be repeated.  Prerequisite: Candidate for Ph.D. degree in history.,,,10423,,A,1,,,A,UNKNOWN,Independent Study,IND,ARRANGED,,,,,
2019,Summer,2019-su,HIST,599,Thesis Research,Individual direction in research and guidance in writing theses for advanced degrees. Approved for S/U grading only. May be repeated.,0 TO 16 hours.,Approved for S/U grading only. May be repeated.,,,10424,,A,1,,,A,UNKNOWN,Independent Study,IND,ARRANGED,,,,,
2019,Summer,2019-su,HNDI,115,Language and Culture in India,Same as LING 115 and REL 115. See REL 115.,3 hours.,Same as LING 115 and REL 115. See REL 115.,Cultural Studies - Non-West course.,,39687,ONL,A,S2,,3 hours,A,UNKNOWN,Online,ONL,ARRANGED,,,,,"Mishra, M"
2019,Summer,2019-su,HORT,293,Off-Campus Horticulture Internship,"Supervised, off-campus experience in a field directly pertaining to a subject matter in horticulture. Approved for S/U grading only. May be repeated in separate terms. Independent Study courses are limited to 12 hours total applying to a degree in ACES. For registration in this course students should contact the Department Undergraduate Program Coordinator. Prerequisite: Sophomore standing, cumulative GPA of 2.0 or above at the time the internship is arranged, and consent of instructor.",1 TO 5 hours.,"Approved for S/U grading only. May be repeated in separate terms. Independent Study courses are limited to 12 hours total applying to a degree in ACES. For registration in this course students should contact the Department Undergraduate Program Coordinator. Prerequisite: Sophomore standing, cumulative GPA of 2.0 or above at the time the internship is arranged, and consent of instructor.",,,31111,,A,1,,,A,UNKNOWN,Internship,INT,ARRANGED,,,,,
2019,Summer,2019-su,HORT,294,On-Campus Horticulture Internship,"Supervised, on-campus learning experience with faculty engaged in research. Approved for S/U grading only. May be repeated in separate terms. Independent Study courses are limited to 12 hours total applying to a degree in ACES. For registration in this course students should contact the Department Undergraduate Program Coordinator. Prerequisite: Sophomore standing, 2.0 GPA, consent of the advisor, and consent of the Department Undergraduate Program Coordinator.",1 TO 5 hours.,"Approved for S/U grading only. May be repeated in separate terms. Independent Study courses are limited to 12 hours total applying to a degree in ACES. For registration in this course students should contact the Department Undergraduate Program Coordinator. Prerequisite: Sophomore standing, 2.0 GPA, consent of the advisor, and consent of the Department Undergraduate Program Coordinator.",,,31112,,A,1,,,A,UNKNOWN,Internship,INT,ARRANGED,,,,,
2019,Summer,2019-su,HORT,295,Undergrad Research or Thesis,"Individual research, special problems, thesis, development and/or design work under the supervision of an appropriate member of the faculty. May be repeated. Independent Study courses are limited to 12 hours total applying to a degree in ACES. Prerequisite: Cumulative GPA of 2.5 or above at the time the activity is arranged and consent of instructor.",1 TO 4 hours.,May be repeated. Independent Study courses are limited to 12 hours total applying to a degree in ACES. Prerequisite: Cumulative GPA of 2.5 or above at the time the activity is arranged and consent of instructor.,,,10425,,A,1,,,A,UNKNOWN,Research,RES,ARRANGED,,,,,
2019,Summer,2019-su,HORT,396,Ug Honors Research or Thesis,"Individual research, special problems, thesis, development and/or design work under the direction of the Honors advisor. May be repeated. Independent Study courses are limited to 12 hours total applying to a degree in ACES. Prerequisite: Junior standing, admission to the ACES Honors Program, and consent of instructor.",1 TO 4 hours.,"May be repeated. Independent Study courses are limited to 12 hours total applying to a degree in ACES. Prerequisite: Junior standing, admission to the ACES Honors Program, and consent of instructor.",,,31110,,A,1,,,A,UNKNOWN,Research,RES,ARRANGED,,,,,
2019,Summer,2019-su,HORT,421,Horticultural Physiology,"Horticultural crop growth is examined in relation to plant structure, environment, and cultural practices. Emphasizes environmental control of whole plant growth as influenced by the supply of the raw materials required for growth: water, carbon dioxide, radiant energy, including the influence of temperature and photoperiod on plant growth and development. The shoot and root interactions with the environment are characterized relative to cultural practices. 4 undergraduate hours. 4 graduate hours. Prerequisite: HORT 100 or IB 103 and junior standing.",4 hours.,4 undergraduate hours. 4 graduate hours. Prerequisite: HORT 100 or IB 103 and junior standing.,,,39146,OLP,A,SF,,,A,UNKNOWN,Online,ONL,06:30 PM,09:30 PM,T,,,"Briskin, D"
2019,Summer,2019-su,HRD,411,Instructional and Training System Design,"Provides instruction and practice in the selection, organization, and preparation of content for instructional programs in business and technical settings. Provides students with a theoretical orientation to instructional design as well as the opportunity to experience the instructional design process as it applies to business and technical settings through the development of instructional materials. 3 undergraduate hours. 4 graduate hours.",3 OR 4 hours.,3 undergraduate hours. 4 graduate hours.,,,40446,MT1,A,,,4 hours,A,UNKNOWN,Online,ONL,06:00 PM,08:00 PM,T,,,"Hwang, S;Ju, B;Li, J"
2019,Summer,2019-su,HRD,472,Learning Technologies,"The course addresses two important needs of educators. First, educators should be aware of recent developments in the area of instructional technology. Second, educators must be able to select, develop, and effectively use appropriate instructional technologies to enhance learning and communication. To meet these needs, this course covers a wide range of instructional technologies that are used for instructional and administrative purposes. Traditional instructional media are considered in the course although significant emphasis is placed on more recent developments that involve the use of the computer and its applications in education. Instructional technologies such as computer-based instruction, computer-based testing, distance learning, interactive video, and intelligent instructional technologies are covered. Through course readings, discussions, and projects, students in the course are expected to gain skills in choosing appropriate instructional technologies, designing effective presentations that rely on those technologies, and properly using instructional technologies to enhance communication with an audience. Same as CI 484. 3 undergraduate hours. 4 graduate hours. Prerequisite: HRD 411 or equivalent course in instructional design.",3 OR 4 hours.,Same as CI 484. 3 undergraduate hours. 4 graduate hours. Prerequisite: HRD 411 or equivalent course in instructional design.,,,38971,MTC,A,S2,,4 hours,A,UNKNOWN,Online,ONL,06:00 PM,08:00 PM,R,,,"Chen, D;Ju, A;Ju, B;Scagnoli, N"
2019,Summer,2019-su,HRD,492,Supervised Internship in HRE,"While employed in approved cooperating organizations, students observe the relationship between HRE and organizational performance. 2 or 4 undergraduate hours. 2 or 4 graduate hours.",2 OR 4 hours.,2 or 4 undergraduate hours. 2 or 4 graduate hours.,,,38038,A,A,1,,4 hours,A,UNKNOWN,Independent Study,IND,ARRANGED,,,,,"Jacobs, R"
2019,Summer,2019-su,HRD,534,Economics of Human Resources,Same as LER 545. See LER 545.,4 hours.,Same as LER 545. See LER 545.,,,39684,A1,A,,,,A,UNKNOWN,Online,ONL,06:00 PM,08:00 PM,R,,,"Sun, Y"
2019,Summer,2019-su,HRD,572,e-Learning Ecologies,"An examination of emerging environments of e-learning, some setting out to emulate the heritage social relationships and discourses of the classroom, others attempting to create new forms of learning. Aims to push the imaginative boundaries of what might be possible in e-learning environments. Explores the ways in which assessments can be constructed and implemented which are integral to the learning process, with the assistance of today's new media, 'big data' and other information technologies. 4 graduate hours. No professional credit.",4 hours.,4 graduate hours. No professional credit.,,,39436,A,A,S2,,,A,UNKNOWN,Online,ONL,01:00 PM,03:00 PM,M,,,"Cope, W;Francis, K"
2019,Summer,2019-su,HUM,191,Freshman Honors Tutorial,Study of selected topics on an individually arranged basis. Open only to honors majors or to Cohn Scholars. May be repeated one time. Prerequisite: Consent of departmental honors adviser.,1 TO 3 hours.,May be repeated one time. Prerequisite: Consent of departmental honors adviser.,,,10430,,A,1,,,A,UNKNOWN,Independent Study,IND,ARRANGED,,,,,
2019,Summer,2019-su,HUM,199,Undergraduate Open Seminar,May be repeated.,1 TO 5 hours.,May be repeated.,,,10431,,A,1,,,A,UNKNOWN,Independent Study,IND,ARRANGED,,,,,
2019,Summer,2019-su,HUM,390,Individual Study,"Supervised reading and research on interdisciplinary humanities topics chosen by the student in consultation with a faculty member. May be repeated to a maximum of 8 hours. Prerequisite: Consent of humanities adviser (An approved Learning Agreement must be submitted to 2002 Lincoln Hall, 702 S. Wright Street, Urbana, not later than the second week of the semester or the first week of the summer session).",2 TO 4 hours.,"May be repeated to a maximum of 8 hours. Prerequisite: Consent of humanities adviser (An approved Learning Agreement must be submitted to 2002 Lincoln Hall, 702 S. Wright Street, Urbana, not later than the second week of the semester or the first week of the summer session).",,,10432,,A,1,,,A,UNKNOWN,Independent Study,IND,ARRANGED,,,,,
2019,Summer,2019-su,HUM,397,Special Topics Junior,"Interdisciplinary seminar and tutorial in selected topics related to one of the options in the humanities major. May be repeated to a maximum of 6 hours. Prerequisite: Junior standing and consent of humanities adviser (Tutorial students must submit an Approved Learning Agreement to 2002 Lincoln Hall, 702 S. Wright Street, Urbana, not later than the second week of the semester or the first week of the summer session).",3 hours.,"May be repeated to a maximum of 6 hours. Prerequisite: Junior standing and consent of humanities adviser (Tutorial students must submit an Approved Learning Agreement to 2002 Lincoln Hall, 702 S. Wright Street, Urbana, not later than the second week of the semester or the first week of the summer session).",,,10434,,A,1,,,A,UNKNOWN,Independent Study,IND,ARRANGED,,,,,
2019,Summer,2019-su,HUM,492,Senior Thesis,"Individual research for majors in humanities leading to the completion of a thesis. 0 to 4 undergraduate hours. No graduate credit. May be repeated to a maximum of 8 hours. Prerequisite: Senior standing, a declared option in humanities major, and consent of advisor.",2 TO 4 hours.,"0 to 4 undergraduate hours. No graduate credit. May be repeated to a maximum of 8 hours. Prerequisite: Senior standing, a declared option in humanities major, and consent of advisor.",,,10433,,A,1,,,A,UNKNOWN,Independent Study,IND,ARRANGED,,,,,
2019,Summer,2019-su,HUM,495,Special Advanced Topics,"Offers interdisciplinary topics in the humanities; topics vary, but normally relate to the interdisciplinary areas of study within the humanities major or to the special humanities facilities (e.g., the Language Learning Laboratory). 3 undergraduate hours. 4 graduate hours. May be repeated as topics vary to a maximum of 6 undergraduate hours or 8 graduate hours. Prerequisite: Will vary according to topic. See Class Schedule.",3 OR 4 hours.,3 undergraduate hours. 4 graduate hours. May be repeated as topics vary to a maximum of 6 undergraduate hours or 8 graduate hours. Prerequisite: Will vary according to topic. See Class Schedule.,,,10436,,A,1,,,A,UNKNOWN,Independent Study,IND,ARRANGED,,,,,
2019,Summer,2019-su,HUM,498,Special Topics Senior,"Interdisciplinary seminar and tutorial in selected topics related to one of the options in the humanities major. 3 undergraduate hours. No graduate credit. May be repeated to a maximum of 6 hours. Prerequisite: Senior standing and consent of humanities adviser (Tutorial students must submit an approved Learning Agreement to 2002 Lincoln Hall, 702 S. Wright Street, Urbana, not later than the second week of the semester or the first week of the summer session).",3 hours.,"3 undergraduate hours. No graduate credit. May be repeated to a maximum of 6 hours. Prerequisite: Senior standing and consent of humanities adviser (Tutorial students must submit an approved Learning Agreement to 2002 Lincoln Hall, 702 S. Wright Street, Urbana, not later than the second week of the semester or the first week of the summer session).",,,10435,,A,1,,,A,UNKNOWN,Independent Study,IND,ARRANGED,,,,,
2019,Summer,2019-su,IB,150,Organismal &amp; Evolutionary Biol,"Introduction to physiology, genetics, and evolution of organisms, and their ecology and diversity.",4 hours.,,Nat Sci & Tech - Life Sciences course.,,37351,A,A,S2,,,A,UNKNOWN,Online,ONL,ARRANGED,,,,,"Clegg, B;Strickland, L"
2019,Summer,2019-su,IB,364,Genomics and Human Health,"Highlights advances in understanding the human genome, by utilizing the latest techniques in bioinformatics, i.e. acquiring, analyzing, storing, and displaying the information from the entire genome and protein sequences. The course describes the theory and practices behind modern sequencing techniques and explores the genome with a particular emphasis on the use of extensive online databases and software. Students will analyze one human disorder using bioinformatics software and databases in order to update older published literature about the genomics underpinning the disorder. Prerequisite: IB 204 or consent of instructor.",3 hours.,Prerequisite: IB 204 or consent of instructor.,,,37352,A,A,S2,,,A,UNKNOWN,Online,ONL,ARRANGED,,,,,"Manaster, J"
2019,Summer,2019-su,IB,390,Introductory Research,"Laboratory and/or field research and/or reading supervised by faculty members in the School of Integrative Biology. Approved for S/U grading only. May be repeated in separate terms up to 10 hours, if topics vary. Credit is not given for more than a combined maximum of 10 hours of IB 390 or IB 490 towards graduation for IB majors. Prerequisite: Consent of instructor.",0 TO 5 hours.,"Approved for S/U grading only. May be repeated in separate terms up to 10 hours, if topics vary. Credit is not given for more than a combined maximum of 10 hours of IB 390 or IB 490 towards graduation for IB majors. Prerequisite: Consent of instructor.",,,32820,,A,1,,,A,UNKNOWN,Independent Study,IND,ARRANGED,,,,,
2019,Summer,2019-su,IB,490,Independent Study,Laboratory and/or field research supervised by faculty members in the School of Integrative Biology. A written report is required. 1 to 5 undergraduate hours. No graduate credit. May be repeated. Credit is not given for more than a combined maximum of 10 hours of IB 390 or IB 490 towards graduation for IB majors. Prerequisite: Consent of instructor.,1 TO 5 hours.,1 to 5 undergraduate hours. No graduate credit. May be repeated. Credit is not given for more than a combined maximum of 10 hours of IB 390 or IB 490 towards graduation for IB majors. Prerequisite: Consent of instructor.,,,32821,,A,1,,,A,UNKNOWN,Independent Study,IND,ARRANGED,,,,,
2019,Summer,2019-su,IB,533,Human Genome &amp; Bioinformatics,"Highlights advances in understanding the human genome, utilizing the latest techniques in bioinformatics, i.e. acquiring, analyzing, storing, and displaying the information from the entire genome and protein sequences. Explores the latest laboratory techniques, as well as the use of extensive online databases and software. Students explore the significance of sequencing the human genome, applying bioinformatics to the genome, and realizing its potential to understand human health, disease, and the place of humans in the large ecosystem. In this course, students also produce teaching materials for their classrooms.",4 hours.,,,,39096,A,A,S2,,,A,UNKNOWN,Online,ONL,ARRANGED,,,,,"Manaster, J"
2019,Summer,2019-su,IB,590,Individual Topics,Individual topics in research conducted under the supervision of faculty members in the School of Integrative Biology. Designed for graduate students who would like to become more familiar with specialized fields of study prior to committing themselves to a specific area for their doctorate degree. Approved for S/U grading only. May be repeated to a maximum of 16 hours. Prerequisite: Consent of instructor.,2 TO 12 hours.,Approved for S/U grading only. May be repeated to a maximum of 16 hours. Prerequisite: Consent of instructor.,,,10455,,A,1,,,A,UNKNOWN,Independent Study,IND,ARRANGED,,,,,
2019,Summer,2019-su,IE,199,Undergraduate Open Seminar,May be repeated.,1 TO 5 hours.,May be repeated.,,,10438,,A,1,,,A,UNKNOWN,Independent Study,IND,ARRANGED,,,,,
2019,Summer,2019-su,IE,297,Independent Study,Individual investigations of any phase of Industrial Engineering. May be repeated in separate terms. Prerequisite: Consent of instructor.,1 TO 4 hours.,May be repeated in separate terms. Prerequisite: Consent of instructor.,,,37190,,A,1,,,A,UNKNOWN,Independent Study,IND,ARRANGED,,,,,
2019,Summer,2019-su,IE,400,Design &amp; Anlys of Experiments,"Concepts and methods of design of experiments for quality design, improvement and control. Simple comparative experiments, including concepts of randomization and blocking, and analysis of variance techniques; factorial and fractional factorial designs; Taguchi's concepts and methods; second-order designs; response surface methodology. Engineering applications and case studies. 3 undergraduate hours. 3 or 4 graduate hours. Prerequisite: IE 300.",3 OR 4 hours.,3 undergraduate hours. 3 or 4 graduate hours. Prerequisite: IE 300.,,,40353,A1,A,,,,A,UNKNOWN,Online,ONL,ARRANGED,,,,,"Chronopoulou, A"
2019,Summer,2019-su,IE,497,Independent Study,Independent study of advanced problems related to industrial engineering. 1 to 4 undergraduate hours. 1 to 4 graduate hours. May be repeated. Prerequisite: Consent of instructor.,1 TO 4 hours.,1 to 4 undergraduate hours. 1 to 4 graduate hours. May be repeated. Prerequisite: Consent of instructor.,,,10441,,A,1,,,A,UNKNOWN,Independent Study,IND,ARRANGED,,,,,
2019,Summer,2019-su,IE,521,Convex Optimization,Finite dimensional convex optimization problems; characterization of optimal solutions; iterative algorithms for differentiable and nondifferentiable problems; distributed optimization algorithms; robust problems and solutions; applications of convex optimization models. Prerequisite: ECE 490 or IE 411; MATH 415; MATH 444.,4 hours.,Prerequisite: ECE 490 or IE 411; MATH 415; MATH 444.,,,40352,A1,A,,,,A,UNKNOWN,Online,ONL,ARRANGED,,,,,"He, N"
2019,Summer,2019-su,IE,531,Algorithms for Data Analytics,"This course will introduce the student to a set of algorithms for data analytics which include: hashing, indexes, caching; algorithms for structured datasets; streaming data modes; PageRank algorithms for market-basket models; clustering algorithms; and case studies. 4 graduate hours. No professional credit. Prerequisite: IE 411, CS 225. ISE graduate students and students enrolled in the Master of Science in Advanced Analytics (MCAA) are eligible to take the course.",4 hours.,"4 graduate hours. No professional credit. Prerequisite: IE 411, CS 225. ISE graduate students and students enrolled in the Master of Science in Advanced Analytics (MCAA) are eligible to take the course.",,,40354,A1,A,,,,A,UNKNOWN,Online,ONL,ARRANGED,,,,,"Sreenivas, R"
