Year,Term,YearTerm,Subject,Number,Name,Description,Credit Hours,Section Info,Degree Attributes,Schedule Information,CRN,Section,Status Code,Part of Term,Section Title,Section Credit Hours,Section Status,Enrollment Status,Type,Type Code,Start Time,End Time,Days of Week,Room,Building,Instructors
2019,Summer,2019-su,CLCV,115,Mythology of Greece and Rome,"Studies the major myths of Greece and Rome and their impact upon later art, music, and literature. Shares two hours of lecture with CLCV 111; additional hour of lecture-discussion for a closer analysis of topics. Credit is not given for both CLCV 115 and CLCV 111.",3 hours.,Credit is not given for both CLCV 115 and CLCV 111.,"Humanities - Lit & Arts, and Cultural Studies - Western course.","In the Fall and Spring semesters, students must register for one discussion and one lecture section.",38658,OL1,A,S2,,,A,UNKNOWN,Online,ONL,ARRANGED,,,,,"Schroer, C"
2019,Summer,2019-su,CLCV,115,Mythology of Greece and Rome,"Studies the major myths of Greece and Rome and their impact upon later art, music, and literature. Shares two hours of lecture with CLCV 111; additional hour of lecture-discussion for a closer analysis of topics. Credit is not given for both CLCV 115 and CLCV 111.",3 hours.,Credit is not given for both CLCV 115 and CLCV 111.,"Humanities - Lit & Arts, and Cultural Studies - Western course.","In the Fall and Spring semesters, students must register for one discussion and one lecture section.",39085,OL2,A,S2,,,A,UNKNOWN,Online,ONL,ARRANGED,,,,,"Goebel, C"
2019,Summer,2019-su,CLCV,115,Mythology of Greece and Rome,"Studies the major myths of Greece and Rome and their impact upon later art, music, and literature. Shares two hours of lecture with CLCV 111; additional hour of lecture-discussion for a closer analysis of topics. Credit is not given for both CLCV 115 and CLCV 111.",3 hours.,Credit is not given for both CLCV 115 and CLCV 111.,"Humanities - Lit & Arts, and Cultural Studies - Western course.","In the Fall and Spring semesters, students must register for one discussion and one lecture section.",40416,OL3,A,S2,,,A,UNKNOWN,Online,ONL,ARRANGED,,,,,"Wells, J"
2019,Summer,2019-su,CLCV,199,Undergraduate Open Seminar,Approved for both letter and S/U grading. May be repeated.,1 TO 5 hours.,Approved for both letter and S/U grading. May be repeated.,,,10535,,A,1,,,A,UNKNOWN,Independent Study,IND,ARRANGED,,,,,
2019,Summer,2019-su,CLCV,291,Freshman Honors Tutorial,Study of selected topics on an individually arranged basis. Open only to honors majors or to Cohn Scholars and Associates. May be repeated one time. Prerequisite: Consent of departmental honors advisor.,1 TO 3 hours.,May be repeated one time. Prerequisite: Consent of departmental honors advisor.,,,10530,,A,1,,,A,UNKNOWN,Independent Study,IND,ARRANGED,,,,,
2019,Summer,2019-su,CLCV,491,Topics Classic Arch &amp; Civ,Study of selected topics; variable content. 3 or 4 undergraduate hours. 3 or 4 graduate hours. May be repeated. Prerequisite: Consent of instructor.,3 OR 4 hours.,3 or 4 undergraduate hours. 3 or 4 graduate hours. May be repeated. Prerequisite: Consent of instructor.,,,10546,,A,1,,,A,UNKNOWN,Independent Study,IND,ARRANGED,,,,,
2019,Summer,2019-su,CLCV,492,Senior Thesis,Thesis and honors; for candidates for departmental distinction in classical civilization and for other seniors. 2 to 4 undergraduate hours. No graduate credit. Prerequisite: Senior standing and consent of Classics Honors Program.,2 TO 4 hours.,2 to 4 undergraduate hours. No graduate credit. Prerequisite: Senior standing and consent of Classics Honors Program.,,,10542,,A,1,,,A,UNKNOWN,Independent Study,IND,ARRANGED,,,,,
2019,Summer,2019-su,CLCV,498,Senior Survey,For candidates for departmental distinction in the classics major. 2 to 4 undergraduate hours. No graduate credit. Prerequisite: Senior standing and consent of Classics Honors Program.,2 TO 4 hours.,2 to 4 undergraduate hours. No graduate credit. Prerequisite: Senior standing and consent of Classics Honors Program.,,,10544,,A,1,,,A,UNKNOWN,Independent Study,IND,ARRANGED,,,,,
2019,Summer,2019-su,CLE,631,Clinical Elective,"This course will expose the students to a clinical specialty to learn more about treatment of disorders, lifestyle of the physicians and the experiences of the patients. Students will learn about interpersonal communication skills, gain a deeper understanding of the environment in which medical devices are used, observe therapeutic treatment in real time, and strengthen the clinical skills. No graduate credit. 1 to 4 professional hours. Approved for S/U grading only. May be repeated up to 16 hours in the same semester to a maximum of 40 hours over separate semesters. Prerequisite: This course is restricted to Carle Illinois College of Medicine students.",1 TO 4 hours.,No graduate credit. 1 to 4 professional hours. Approved for S/U grading only. May be repeated up to 16 hours in the same semester to a maximum of 40 hours over separate semesters. Prerequisite: This course is restricted to Carle Illinois College of Medicine students.,,,40450,A,A,1,,,A,UNKNOWN,Independent Study,IND,ARRANGED,,,,,"Campos Coiado, O;Pluta, W;Thomas, K"
2019,Summer,2019-su,CLE,640,Family Medicine Clerkship,"This longitudinal clerkship provides an exciting opportunity for students to have clinical experiences within their own student clinic, as well as ambulatory practices in disciplines such as psychiatry, pediatrics, and family medicine. Students will learn the core skills and knowledge essential to the practice of primary care: diagnosis and treatment of common outpatient complaints, management of chronic medical conditions, and strategies for health promotion and disease prevention. No graduate credit. 10 professional hours. Approved for S/U grading only. Prerequisite: This course is restricted to students enrolled in the MD program at Carle Illinois College of Medicine.",10 hours.,No graduate credit. 10 professional hours. Approved for S/U grading only. Prerequisite: This course is restricted to students enrolled in the MD program at Carle Illinois College of Medicine.,,,40300,A,A,,,,A,UNKNOWN,Lecture-Discussion,LCD,10:00 AM,11:50 AM,F,106B3,Engineering Hall,"Deedrich, D;Pecenka, C;Pluta, W"
2019,Summer,2019-su,CMN,101,Public Speaking,"Preparation and presentation of short informative and persuasive speeches; emphasis on the selection and organization of material, methods of securing interest and attention, and the elements of delivery. Credit is not given for both CMN 101 and either CMN 111 or CMN 112.",3 hours.,Credit is not given for both CMN 101 and either CMN 111 or CMN 112.,,,34794,,A,S2,,,A,UNKNOWN,Lecture-Discussion,LCD,09:00 AM,11:50 AM,TR,4053,Lincoln Hall,"Weeks, K"
2019,Summer,2019-su,CMN,101,Public Speaking,"Preparation and presentation of short informative and persuasive speeches; emphasis on the selection and organization of material, methods of securing interest and attention, and the elements of delivery. Credit is not given for both CMN 101 and either CMN 111 or CMN 112.",3 hours.,Credit is not given for both CMN 101 and either CMN 111 or CMN 112.,,,34795,,A,S1,,,A,UNKNOWN,Lecture-Discussion,LCD,09:00 AM,11:50 AM,MTWR,1064,Lincoln Hall,"Smith, M"
2019,Summer,2019-su,CMN,191,Freshman Honors Tutorial,"Study of selected topics on an individually arranged basis. Open only to Chancellors Scholars, Cohn Scholars and James Scholars. May be repeated one time. Prerequisite: Consent of departmental honors advisor.",1 TO 3 hours.,May be repeated one time. Prerequisite: Consent of departmental honors advisor.,,,34847,,A,1,,,A,UNKNOWN,Independent Study,IND,ARRANGED,,,,,
2019,Summer,2019-su,CMN,199,Undergraduate Open Seminar,May be repeated to a maximum of 6 hours.,0 TO 5 hours.,May be repeated to a maximum of 6 hours.,,,34848,,A,1,,,A,UNKNOWN,Independent Study,IND,ARRANGED,,,,,
2019,Summer,2019-su,CMN,210,Public Comm in Everyday Life,"Introduces concepts useful for the critical analysis of public communication in everyday life. Drawing on communication theory and practice, especially theories of rhetoric, the course investigates techniques of persuasion, offers tools for critical analysis of public discourse, and considers the political and ethical implications of various forms of public communication.",3 hours.,,"Humanities - Hist & Phil, and Cultural Studies - Western course.",,38326,OL1,A,S2,,,A,UNKNOWN,Online,ONL,ARRANGED,,,,,"O'Gorman, T"
2019,Summer,2019-su,CMN,210,Public Comm in Everyday Life,"Introduces concepts useful for the critical analysis of public communication in everyday life. Drawing on communication theory and practice, especially theories of rhetoric, the course investigates techniques of persuasion, offers tools for critical analysis of public discourse, and considers the political and ethical implications of various forms of public communication.",3 hours.,,"Humanities - Hist & Phil, and Cultural Studies - Western course.",,39119,OL2,A,S2,,,A,UNKNOWN,Online,ONL,ARRANGED,,,,,"Izaguirre, J"
2019,Summer,2019-su,CMN,210,Public Comm in Everyday Life,"Introduces concepts useful for the critical analysis of public communication in everyday life. Drawing on communication theory and practice, especially theories of rhetoric, the course investigates techniques of persuasion, offers tools for critical analysis of public discourse, and considers the political and ethical implications of various forms of public communication.",3 hours.,,"Humanities - Hist & Phil, and Cultural Studies - Western course.",,39363,OL3,A,S2,,,A,UNKNOWN,Online,ONL,ARRANGED,,,,,"Reckard, B"
2019,Summer,2019-su,CMN,212,Intro to Organizational Comm,"Considers major theories, research questions, and approaches to organizational communication.",3 hours.,,,,37873,,A,S2,,,A,UNKNOWN,Online,ONL,ARRANGED,,,,,"Bryan, A"
2019,Summer,2019-su,CMN,212,Intro to Organizational Comm,"Considers major theories, research questions, and approaches to organizational communication.",3 hours.,,,,39120,,A,S2,,,A,UNKNOWN,Online,ONL,ARRANGED,,,,,"Kimnach, R"
2019,Summer,2019-su,CMN,260,Intro to Health Communication,"Introduces theory and research on communication in health and illness contexts. Explores how messages from media, interpersonal, and organizational sources affect health beliefs and behaviors.",3 hours.,,"Social & Beh Sci - Beh Sci, and Cultural Studies - Western course.",,36318,OL1,A,S2,,,A,UNKNOWN,Online,ONL,ARRANGED,,,,,"Al-Ghaithi, S"
2019,Summer,2019-su,CMN,260,Intro to Health Communication,"Introduces theory and research on communication in health and illness contexts. Explores how messages from media, interpersonal, and organizational sources affect health beliefs and behaviors.",3 hours.,,"Social & Beh Sci - Beh Sci, and Cultural Studies - Western course.",,34806,OL2,A,S2,,,A,UNKNOWN,Online,ONL,ARRANGED,,,,,"Liao, D"
2019,Summer,2019-su,CMN,304,Communication Internship,Directed internship experience for Communication majors. Students must have consent of the Internship Coordinator. May be repeated in separate terms to a maximum of 6 hours.,1 TO 3 hours.,May be repeated in separate terms to a maximum of 6 hours.,,,37257,,A,1,,,A,UNKNOWN,Independent Study,IND,ARRANGED,,,,,
2019,Summer,2019-su,CMN,336,Family Communication,"Examines the nature and functions of communication in various family configurations (e.g. nuclear families, single-parent families, stepfamilies); discusses both problematic interaction patterns and links between family interaction and strong families.",3 hours.,,,,37340,,A,S2,,,A,UNKNOWN,Online,ONL,ARRANGED,,,,,"Moga, J"
2019,Summer,2019-su,CMN,336,Family Communication,"Examines the nature and functions of communication in various family configurations (e.g. nuclear families, single-parent families, stepfamilies); discusses both problematic interaction patterns and links between family interaction and strong families.",3 hours.,,,,37341,,A,S2,,,A,UNKNOWN,Online,ONL,ARRANGED,,,,,"Hebert, M"
2019,Summer,2019-su,CMN,336,Family Communication,"Examines the nature and functions of communication in various family configurations (e.g. nuclear families, single-parent families, stepfamilies); discusses both problematic interaction patterns and links between family interaction and strong families.",3 hours.,,,,37910,,A,S2,,,A,UNKNOWN,Online,ONL,ARRANGED,,,,,"Ramey, M"
2019,Summer,2019-su,CMN,340,Visual Politics,"Explores the role of visual images in U.S. culture, paying special attention to the ways that images function persuasively as political communication. Provides tools for analyzing historical and contemporary images and artifacts, such as photographs, prints, paintings, advertisements, and memorials. Emphasis on how visual images are used for remembering and memorializing; confronting and resisting; consuming and commodifying; governing and authorizing; and visualizing and informing.",3 hours.,,,,37433,,A,S2,,,A,UNKNOWN,Online,ONL,ARRANGED,,,,,"Axtman-Barker, P"
2019,Summer,2019-su,CMN,340,Visual Politics,"Explores the role of visual images in U.S. culture, paying special attention to the ways that images function persuasively as political communication. Provides tools for analyzing historical and contemporary images and artifacts, such as photographs, prints, paintings, advertisements, and memorials. Emphasis on how visual images are used for remembering and memorializing; confronting and resisting; consuming and commodifying; governing and authorizing; and visualizing and informing.",3 hours.,,,,38810,,A,S2,,,A,UNKNOWN,Online,ONL,ARRANGED,,,,,"Bacon, E"
2019,Summer,2019-su,CMN,340,Visual Politics,"Explores the role of visual images in U.S. culture, paying special attention to the ways that images function persuasively as political communication. Provides tools for analyzing historical and contemporary images and artifacts, such as photographs, prints, paintings, advertisements, and memorials. Emphasis on how visual images are used for remembering and memorializing; confronting and resisting; consuming and commodifying; governing and authorizing; and visualizing and informing.",3 hours.,,,,40342,,A,S2,,,A,UNKNOWN,Online,ONL,ARRANGED,,,,,"DeVinney, D"
2019,Summer,2019-su,CMN,390,Individual Study,Individual investigation of special problems. May be repeated to a maximum of 6 hours. Prerequisite: Twelve hours of communication coursework; a grade-point average of 3.25; and consent of head of department.,1 TO 3 hours.,May be repeated to a maximum of 6 hours. Prerequisite: Twelve hours of communication coursework; a grade-point average of 3.25; and consent of head of department.,,,34849,,A,1,,,A,UNKNOWN,Independent Study,IND,ARRANGED,,,,,
2019,Summer,2019-su,CMN,491,Honors Individual Study,Individual investigation of special problems. 2 undergraduate hours. No graduate credit. May be repeated to a maximum of 4 undergraduate hours. Prerequisite: Twelve hours of communication; a grade-point average of 3.50; and consent of head of department.,2 hours.,2 undergraduate hours. No graduate credit. May be repeated to a maximum of 4 undergraduate hours. Prerequisite: Twelve hours of communication; a grade-point average of 3.50; and consent of head of department.,,,34850,,A,1,,,A,UNKNOWN,Independent Study,IND,ARRANGED,,,,,
2019,Summer,2019-su,CMN,493,Honors Senior Thesis,Individual study leading to a thesis for honors in the Department of Communication. 2 undergraduate hours. No graduate credit. May be repeated to a maximum of 4 undergraduate hours. Prerequisite: Senior standing; a grade-point average of 3.50; and consent of head of department.,2 hours.,2 undergraduate hours. No graduate credit. May be repeated to a maximum of 4 undergraduate hours. Prerequisite: Senior standing; a grade-point average of 3.50; and consent of head of department.,,,34851,,A,1,,,A,UNKNOWN,Independent Study,IND,ARRANGED,,,,,
2019,Summer,2019-su,CMN,502,Health Comm Research Methods I,Introduction to social scientific methods for research on health communication and health outcomes. These methods may be used either to build general (theoretical) knowledge about communication or to aid in design and evaluation of actual messages and campaigns. Spring terms only. Prerequisite: Only for students enrolled in the MS in Health Communication degree program.,2 hours.,Spring terms only. Prerequisite: Only for students enrolled in the MS in Health Communication degree program.,,,40292,,A,,,,A,UNKNOWN,Online,ONL,ARRANGED,,,,,"Reznik, R"
2019,Summer,2019-su,CMN,503,Health Comm Research MethodsII,Focuses on analytic strategy in both qualitative and quantitative analysis. Complements and expands upon the social scientific methods for collecting data introduced in CMN 502. Prerequisite: CMN 502 strongly recommended.,2 hours.,Prerequisite: CMN 502 strongly recommended.,,Only for students enrolled in the MS in Health Communication degree program.,40293,,A,,,,A,UNKNOWN,Online,ONL,ARRANGED,,,,,"Reznik, R"
2019,Summer,2019-su,CMN,529,Seminar Communication Theory,Special topics in communication theory and research. May be repeated to a maximum of 16 hours. Prerequisite: Consent of instructor.,4 hours.,May be repeated to a maximum of 16 hours. Prerequisite: Consent of instructor.,,,34812,,A,S2,Comm in Theory and Practice,,A,UNKNOWN,Lecture-Discussion,LCD,12:30 PM,03:20 PM,TR,4103,Lincoln Hall,"Dixon, T"
2019,Summer,2019-su,CMN,575,Capstone Individual Study,Provides capstone experience for students in the MS in Health Communication degree program.,4 hours.,,,,37003,ONL,A,,,,A,UNKNOWN,Online,ONL,ARRANGED,,,,,"Quick, B;Weiner, L"
2019,Summer,2019-su,CMN,595,Special Problems,Individual investigation of special projects not included in theses. May be repeated in separate terms. Open to master's candidates for a maximum of 4 graduate hours and to doctoral candidates for a maximum of 12 graduate hours. Prerequisite: Consent from head of department.,1 TO 12 hours.,May be repeated in separate terms. Open to master's candidates for a maximum of 4 graduate hours and to doctoral candidates for a maximum of 12 graduate hours. Prerequisite: Consent from head of department.,,,34852,,A,1,,,A,UNKNOWN,Independent Study,IND,ARRANGED,,,,,
2019,Summer,2019-su,CMN,595,Special Problems,Individual investigation of special projects not included in theses. May be repeated in separate terms. Open to master's candidates for a maximum of 4 graduate hours and to doctoral candidates for a maximum of 12 graduate hours. Prerequisite: Consent from head of department.,1 TO 12 hours.,May be repeated in separate terms. Open to master's candidates for a maximum of 4 graduate hours and to doctoral candidates for a maximum of 12 graduate hours. Prerequisite: Consent from head of department.,,,40419,LW,A,,Independent Study,4 hours,A,UNKNOWN,Online,ONL,ARRANGED,,,,,"Weiner, L"
2019,Summer,2019-su,CMN,595,Special Problems,Individual investigation of special projects not included in theses. May be repeated in separate terms. Open to master's candidates for a maximum of 4 graduate hours and to doctoral candidates for a maximum of 12 graduate hours. Prerequisite: Consent from head of department.,1 TO 12 hours.,May be repeated in separate terms. Open to master's candidates for a maximum of 4 graduate hours and to doctoral candidates for a maximum of 12 graduate hours. Prerequisite: Consent from head of department.,,,38923,ONL,A,,HCOM Independent Study,2 hours,A,UNKNOWN,Online,ONL,ARRANGED,,,,,"Weiner, L"
2019,Summer,2019-su,CMN,599,Thesis Research,Approved for S/U grading only. May be repeated.,0 TO 16 hours.,Approved for S/U grading only. May be repeated.,,,34855,,A,1,,,A,UNKNOWN,Independent Study,IND,ARRANGED,,,,,
2019,Summer,2019-su,CPSC,131,Agriculture in Mythology,Compare and contrast the role agriculture and plant sciences played in the development of ancient cultures. Study agricultural references in ancient global mythology. Develop an appreciation of how agricultural diversity of various ancient cultures influenced mythology in the cultures in different regions.,3 hours.,,Cultural Studies - Non-West course.,,40178,ONL,A,S2,,,A,UNKNOWN,Online,ONL,06:30 PM,08:30 PM,TR,,,"Rayburn, A"
2019,Summer,2019-su,CPSC,293,Off-Campus Crop Sci Internship,"Supervised, off-campus experience in a field directly pertaining to a subject matter in crop sciences. Approved for S/U grading only. May be repeated in separate terms. Independent Study courses are limited to 12 hours total applying to a degree in ACES. For registration in this course, students should contact the Department Undergraduate Program Coordinator. Prerequisite: Sophomore standing, cumulative GPA of 2.0 or above at the time the internship is arranged, and consent of instructor.",1 TO 5 hours.,"Approved for S/U grading only. May be repeated in separate terms. Independent Study courses are limited to 12 hours total applying to a degree in ACES. For registration in this course, students should contact the Department Undergraduate Program Coordinator. Prerequisite: Sophomore standing, cumulative GPA of 2.0 or above at the time the internship is arranged, and consent of instructor.",,,10555,,A,1,,,A,UNKNOWN,Internship,INT,ARRANGED,,,,,
2019,Summer,2019-su,CPSC,294,On-Campus Crop Sci Internship,"Supervised, on-campus learning experience with faculty engaged in research. Approved for S/U grading only. May be repeated in separate terms. Independent Study courses are limited to 12 hours total applying to a degree in ACES. For registration in this course students should contact the Department Undergraduate Program Coordinator. Prerequisite: Sophomore standing, 2.0 GPA, consent of the advisor, and consent of the Department Undergraduate Program Coordinator.",1 TO 5 hours.,"Approved for S/U grading only. May be repeated in separate terms. Independent Study courses are limited to 12 hours total applying to a degree in ACES. For registration in this course students should contact the Department Undergraduate Program Coordinator. Prerequisite: Sophomore standing, 2.0 GPA, consent of the advisor, and consent of the Department Undergraduate Program Coordinator.",,,10558,,A,1,,,A,UNKNOWN,Internship,INT,ARRANGED,,,,,
2019,Summer,2019-su,CPSC,295,Undergrad Research or Thesis,"Individual research, special problems, thesis, development and/or design work under the supervision of an appropriate member of the faculty. May be repeated. Independent Study courses are limited to 12 hours total applying to a degree in ACES. Prerequisite: Cumulative GPA of 2.5 or above at the time the activity is arranged and consent of instructor.",1 TO 4 hours.,May be repeated. Independent Study courses are limited to 12 hours total applying to a degree in ACES. Prerequisite: Cumulative GPA of 2.5 or above at the time the activity is arranged and consent of instructor.,,,10560,,A,1,,,A,UNKNOWN,Research,RES,ARRANGED,,,,,
2019,Summer,2019-su,CPSC,396,Undergrad Honors Res or Thesis,"Individual research, special problems, thesis, development and/or design work under the direction of the Honors advisor. May be repeated. Independent Study courses are limited to 12 hours total applying to a degree in ACES. Prerequisite: Junior standing, admission to the ACES Honors Program, and consent of instructor.",1 TO 4 hours.,"May be repeated. Independent Study courses are limited to 12 hours total applying to a degree in ACES. Prerequisite: Junior standing, admission to the ACES Honors Program, and consent of instructor.",,,10562,,A,1,,,A,UNKNOWN,Research,RES,ARRANGED,,,,,
2019,Summer,2019-su,CPSC,413,"Agriculture, Food, and the Environment",Advanced course in the complex interactions of food production resulting from different agricultural systems and the environment. Develop an appreciation of the intricacies of producing food for a growing world population while minimizing the impact on the natural environment. Understand the implementation of new technology and strategies for future food production. 2 undergraduate hours. 2 graduate hours. Prerequisite: CPSC 112 or CPSC 113 or equivalent course or consent of instructor. For Online MS Program.,2 hours.,2 undergraduate hours. 2 graduate hours. Prerequisite: CPSC 112 or CPSC 113 or equivalent course or consent of instructor. For Online MS Program.,,,39104,OLP,A,S2,,,A,UNKNOWN,Online,ONL,06:30 PM,09:30 PM,W,,,"Rayburn, A"
2019,Summer,2019-su,CPSC,413,"Agriculture, Food, and the Environment",Advanced course in the complex interactions of food production resulting from different agricultural systems and the environment. Develop an appreciation of the intricacies of producing food for a growing world population while minimizing the impact on the natural environment. Understand the implementation of new technology and strategies for future food production. 2 undergraduate hours. 2 graduate hours. Prerequisite: CPSC 112 or CPSC 113 or equivalent course or consent of instructor. For Online MS Program.,2 hours.,2 undergraduate hours. 2 graduate hours. Prerequisite: CPSC 112 or CPSC 113 or equivalent course or consent of instructor. For Online MS Program.,,,40343,ONL,A,S2,,,A,UNKNOWN,Online,ONL,06:30 PM,09:30 PM,W,,,"Rayburn, A"
2019,Summer,2019-su,CPSC,593,Adv Studies in Crop Sciences,Directed studies of selected problems or topics relevant to Crop Sciences. Study may be in one of the following fields: 1) Plant Breeding and Genetics; 2) Plant Molecular Biology; 3) Plant Physiology; 4) Crop Production and Ecology; 5) Biometrics; 6) Plant Pathology; 7) Entomology; and 8) Weed Science. Prerequisite: Consent of instructor.,1 TO 8 hours.,Prerequisite: Consent of instructor.,,,10567,,A,1,,,A,UNKNOWN,Independent Study,IND,ARRANGED,,,,,
