Year,Term,YearTerm,Subject,Number,Name,Description,Credit Hours,Section Info,Degree Attributes,Schedule Information,CRN,Section,Status Code,Part of Term,Section Title,Section Credit Hours,Section Status,Enrollment Status,Type,Type Code,Start Time,End Time,Days of Week,Room,Building,Instructors
2019,Winter,2019-wi,PSYC,230,Perception &amp; Sensory Processes,Survey of the experimental psychology of sensory and perceptual processes and behavior; emphasis on the contribution of behavior science to understanding subjective experience of the physical and social environment.,3 hours.,,Social & Beh Sci - Beh Sci course.,,10061,A,A,1,,,A,UNKNOWN,Online,ONL,ARRANGED,,,,,"Ballew, K;Lleras Buetti, S;Ng, J"
2019,Winter,2019-wi,RST,100,"Recreation, Sport, and Tourism in Modern Society","This course examines central issues in defining leisure, recreation, sport, and tourism. Historical, philosophical, sociological, psychological, and economic approaches to understanding these areas, their behaviors and meanings, social contexts, and personal and social resources are examined. By the end of the semester, students should understand their history and evolution, as well as their impact on contemporary society.",3 hours.,,Social & Beh Sci - Soc Sci course.,,10041,ONL,A,1,,,A,UNKNOWN,Online,ONL,ARRANGED,,,,,"Shinew, K"
2019,Winter,2019-wi,SOC,100,Introduction to Sociology,"Sociology offers a unique lens through which we can examine the world around us. In this course you will develop a perspective that will allow you to analyze the social world in a way that reveals the hidden and/or overlooked social forces that shape our lives. This approach, the sociological imagination, will enable you to explore how social forces influence the ways we view and navigate our social world. We will discuss how sociologists use theory and research to better understand important social issues such as inequalities of race, class, gender, sexualities and how social order and social change are possible. We will discuss how society affects individuals and in turn how individuals can affect society.",4 hours.,,Social & Beh Sci - Soc Sci course.,Students must register for one discussion and one lecture section.,10018,ONL,A,1,,,A,UNKNOWN,Online,ONL,ARRANGED,,,,,"Steward, D"
2019,Winter,2019-wi,SOC,130,Intro Gender &amp; Women's Studies,Same as GWS 100 and HDFS 140. See GWS 100.,3 hours.,Same as GWS 100 and HDFS 140. See GWS 100.,Social & Beh Sci - Soc Sci course.,,10044,AA,A,1,,,A,UNKNOWN,Online,ONL,ARRANGED,,,,,"Cole, C"
2019,Winter,2019-wi,SPAN,130,Intermediate Spanish,"Continued development of reading, writing and conversational skills. This is considered a third level course for purposes of fulfilling the University General Education Language requirement. Credit is not given for both SPAN 130 and SPAN 103. Prerequisite: SPAN 122 or equivalent placement score.",4 hours.,Credit is not given for both SPAN 130 and SPAN 103. Prerequisite: SPAN 122 or equivalent placement score.,,"Class meetings constitute half of the credit hour requirement, the other half is met by on-line, web-based work. Spanish native speakers should enroll in SPAN 125.",10039,A,A,1,,,A,UNKNOWN,Online,ONL,ARRANGED,,,,,"Abbott, A"
2019,Winter,2019-wi,SPAN,142,Spanish in the Professions,"Introduction to Spanish in business, law, medical, education & social service fields, with a focus on the importance of bilingualism in the U.S., strategies for lifelong learning, and culture considerations. The development of functional use of Spanish within the professional context is the major focus of the course. This is considered a fourth level course for purposes of fulfilling the University General Education Language requirement. Credit is not given for both SPAN 141 and SPAN 142. Prerequisite: SPAN 130 (formerly numbered 103), equivalent course, or placement score.",4 hours.,"Credit is not given for both SPAN 141 and SPAN 142. Prerequisite: SPAN 130 (formerly numbered 103), equivalent course, or placement score.",,,10040,A,A,1,,,A,UNKNOWN,Online,ONL,ARRANGED,,,,,"Henshaw, F"
